School_ID,NAME_OF_SCHOOL,Street_Address,City,ZIP_Code,Network_Manager,CPS_Performance_Policy_Status,CPS_Performance_Policy_Level,HEALTHY_SCHOOL_CERTIFIED,Safety_Icon ,SAFETY_SCORE,Longitude,Latitude,COMMUNITY_AREA_NUMBER,COMMUNITY_AREA_NAME,Ward,Police_District
610195,Elizabeth H Sutherland Elementary School,10015 S Leavitt St ,Chicago,60643,Rock Island Elementary Network,Not on Probation,Level 2,No,Very Strong,86,-87.67678398,41.71142687,72,BEVERLY,19,22
610119,Elizabeth Peabody Elementary School,1444 W Augusta Blvd ,Chicago,60622,Fulton Elementary Network,Not on Probation,Level 2,No,Average,51,-87.66419014,41.89986912,24,WEST TOWN,27,13
609852,Eliza Chappell Elementary School,2135 W Foster Ave ,Chicago,60625,Ravenswood-Ridge Elementary Network,Not on Probation,Level 1,No,Strong,70,-87.68325438,41.975867,4,LINCOLN SQUARE,47,20
610235,Ella Flagg Young Elementary School,1434 N Parkside Ave ,Chicago,60651,Austin-North Lawndale Elementary Network,Not on Probation,Level 2,No,Weak,31,-87.76717934,41.90678358,25,AUSTIN,29,25
609682,Ellen H Richards Career Academy High School,5009 S Laflin St ,Chicago,60609,Southwest Side High School Network,Probation,Level 2,No,Weak,30,-87.66224052,41.80285552,61,NEW CITY,16,9
610073,Ellen Mitchell Elementary School,2233 W Ohio St ,Chicago,60612,Fulton Elementary Network,Not on Probation,Level 1,No,Very Strong,99,-87.68317867,41.89205482,24,WEST TOWN,26,13
609712,Emil G Hirsch Metropolitan High School,7740 S Ingleside Ave ,Chicago,60619,South Side High School Network,Probation,Level 3,No,Very Weak,13,-87.60176452,41.7537612,69,GREATER GRAND CROSSING,8,6
609973,Emiliano Zapata Elementary Academy,2728 S Kostner Ave ,Chicago,60623,Pilsen-Little Village Elementary Network,Not on Probation,Level 2,No,Strong,60,-87.73434997,41.84139181,30,SOUTH LAWNDALE,22,10
610065,Emmett Louis Till Math and Science Academy,6543 S Champlain Ave ,Chicago,60637,Burnham Park Elementary Network,Probation,Level 3,No,Weak,31,-87.60932095,41.77544062,42,WOODLAWN,20,3
609916,Enrico Fermi Elementary School,1415 E 70th St ,Chicago,60637,Skyway Elementary Network,Probation,Level 3,No,Weak,30,-87.59039017,41.76772772,43,SOUTH SHORE,5,3
610203,Enrico Tonti Elementary School,5815 S Homan Ave ,Chicago,60629,Midway Elementary Network,Not on Probation,Level 2,No,NDA,,-87.70814201,41.78750499,63,GAGE PARK,14,8
610543,Eric Solorio Academy High School,5400 S St Louis Ave ,Chicago,60632,AUSL Schools,Not on Probation,Not Enough Data,No,Strong,67,-87.71109447,41.79518118,63,GAGE PARK,14,8
610137,Ernst Prussing Elementary School,4650 N Menard Ave ,Chicago,60630,O'Hare Elementary Network,Not on Probation,Level 2,No,Strong,71,-87.77245066,41.96561054,15,PORTAGE PARK,45,16
609908,Esmond Elementary School,1865 W Montvale ,Chicago,60643,Rock Island Elementary Network,Probation,Level 2,No,Weak,36,-87.66916143,41.68939069,75,MORGAN PARK,19,22
609918,Eugene Field Elementary School,7019 N Ashland Ave ,Chicago,60626,Ravenswood-Ridge Elementary Network,Not on Probation,Level 2,No,Average,42,-87.66994862,42.00966462,1,ROGERS PARK,49,24
609874,Everett McKinley Dirksen Elementary School,8601 W Foster Ave ,Chicago,60656,O'Hare Elementary Network,Not on Probation,Level 1,No,Average,44,-87.84105162,41.97368728,76,OHARE,41,16
610319,Evergreen Academy Middle School,3537 S Paulina St ,Chicago,60609,Pershing Elementary Network,Not on Probation,Level 2,No,Strong,60,-87.66778007,41.829365,59,MCKINLEY PARK,11,9
610057,Fairfield Elementary Academy,6201 S Fairfield Ave ,Chicago,60629,Midway Elementary Network,Probation,Level 3,No,Weak,31,-87.69207758,41.78086789,66,CHICAGO LAWN,15,8
610541,Federico Garcia Lorca Elementary School,3231 N Springfield Ave ,Chicago,60618,Fullerton Elementary Network,Not on Probation,Not Enough Data,No,Average,53,-87.72474354,41.94001885,21,AVONDALE,30,17
610308,Wilma Rudolph Elementary Learning Center,110 N Paulina St ,Chicago,60612,Fulton Elementary Network,Not Applicable,Not Enough Data,No,NDA,,-87.66951363,41.88357478,28,NEAR WEST SIDE,27,13
610120,Ferdinand Peck Elementary School,3826 W 58th St ,Chicago,60629,Midway Elementary Network,Not on Probation,Level 1,No,Average,51,-87.71922211,41.78792632,62,WEST ELSDON,13,8
609917,Fernwood Elementary School,10041 S Union Ave ,Chicago,60628,Rock Island Elementary Network,Probation,Level 3,No,Weak,29,-87.6403774,41.71119799,73,WASHINGTON HEIGHTS,34,22
610258,Florence B Price Elementary School,4351 S Drexel Blvd ,Chicago,60653,Burnham Park Elementary Network,Probation,Level 3,No,Weak,20,-87.6038735,41.81534262,39,KENWOOD,4,2
610096,Florence Nightingale Elementary School,5250 S Rockwell St ,Chicago,60632,Midway Elementary Network,Not on Probation,Level 2,No,Weak,35,-87.68917624,41.79774019,63,GAGE PARK,14,9
609924,Fort Dearborn Elementary School,9025 S Throop St ,Chicago,60620,Rock Island Elementary Network,Not on Probation,Level 2,No,Weak,34,-87.65544435,41.72966698,73,WASHINGTON HEIGHTS,21,22
609927,Foster Park Elementary School,8530 S Wood St ,Chicago,60620,Englewood-Gresham Elementary Network,Probation,Level 3,No,Very Weak,11,-87.66813597,41.7384262,71,AUBURN GRESHAM,18,6
610215,Francisco I Madero Middle School,3202 W 28th St ,Chicago,60623,Pilsen-Little Village Elementary Network,Probation,Level 2,Yes,Average,49,-87.70508585,41.84098398,30,SOUTH LAWNDALE,22,10
610067,Francis M McKay Elementary School,6901 S Fairfield Ave ,Chicago,60629,Midway Elementary Network,Probation,Level 3,No,Weak,23,-87.69174944,41.76810662,66,CHICAGO LAWN,18,8
610114,Francis Parkman Elementary School,245 W 51st St ,Chicago,60609,Pershing Elementary Network,Probation,Level 3,No,Weak,38,-87.63297392,41.80169919,37,FULLER PARK,3,9
610020,Francis Scott Key Elementary School,517 N Parkside Ave ,Chicago,60644,Austin-North Lawndale Elementary Network,Probation,Level 2,No,Weak,37,-87.76633519,41.88983589,25,AUSTIN,29,15
610112,Francis W Parker Elementary Community Academy,6800 S Stewart Ave ,Chicago,60621,Englewood-Gresham Elementary Network,Not on Probation,Level 2,No,Weak,30,-87.6353099,41.77079606,68,ENGLEWOOD,6,7
609800,Frank I Bennett Elementary School,10115 S Prairie Ave ,Chicago,60628,Rock Island Elementary Network,Probation,Level 3,No,Average,46,-87.61735342,41.71041656,49,ROSELAND,9,5
609939,Frank L Gillespie Elementary School,9301 S State St ,Chicago,60619,Rock Island Elementary Network,Probation,Level 2,No,Weak,27,-87.62368165,41.72529635,49,ROSELAND,6,6
609926,Franklin Elementary Fine Arts Center,225 W Evergreen Ave ,Chicago,60610,Fullerton Elementary Network,Not on Probation,Level 1,No,Very Strong,87,-87.6355136,41.90657253,8,NEAR NORTH SIDE,43,18
609958,Frank W Gunsaulus Elementary Scholastic Academy,4420 S Sacramento Ave ,Chicago,60632,Pershing Elementary Network,Not on Probation,Level 1,No,Average,46,-87.69940042,41.81299531,58,BRIGHTON PARK,14,9
610144,Frank W Reilly Elementary School,3650 W School St ,Chicago,60618,Fullerton Elementary Network,Probation,Level 2,No,Average,48,-87.71953058,41.94112155,21,AVONDALE,35,17
610165,Franz Peter Schubert Elementary School,2727 N Long Ave ,Chicago,60639,Fullerton Elementary Network,Probation,Level 3,No,NDA,,-87.76115305,41.93038593,19,BELMONT CRAGIN,31,25
610503,Frazier Prospective IB Magnet Elementary School,4027 W Grenshaw St ,Chicago,60624,Austin-North Lawndale Elementary Network,Not on Probation,Level 1,No,Strong,60,-87.72631742,41.86695871,29,NORTH LAWNDALE,24,11
609854,Frederic Chopin Elementary School,2450 W Rice St ,Chicago,60622,Fulton Elementary Network,Not on Probation,Level 1,No,Very Strong,86,-87.68890154,41.89674048,24,WEST TOWN,1,13
610245,Frederick A Douglass Academy High School,543 N Waller Ave ,Chicago,60644,West Side High School Network,Probation,Level 3,No,Average,44,-87.76763207,41.89037849,25,AUSTIN,29,15
609930,Frederick Funston Elementary School,2010 N Central Park ,Chicago,60647,Fullerton Elementary Network,Probation,Level 3,No,Very Weak,16,-87.71692852,41.91762127,22,LOGAN SQUARE,26,25
610163,Frederick Stock Elementary School,7507 W Birchwood Ave ,Chicago,60631,O'Hare Elementary Network,NDA,NDA,No,NDA,,-87.81420664,42.0168639,9,EDISON PARK,41,16
610010,Friedrich Ludwig Jahn Elementary School,3149 N Wolcott Ave ,Chicago,60657,Ravenswood-Ridge Elementary Network,Not on Probation,Level 2,No,Strong,72,-87.67577282,41.93924404,5,NORTH CENTER,32,19
609737,Friedrich W von Steuben Metropolitan Science High School,5039 N Kimball Ave ,Chicago,60625,North-Northwest Side High School Network,Not on Probation,Level 2,No,Strong,70,-87.71334969,41.9731926,13,NORTH PARK,39,17
609709,Gage Park High School,5630 S Rockwell St ,Chicago,60629,Southwest Side High School Network,Probation,Level 3,No,Very Weak,14,-87.68899064,41.79101352,63,GAGE PARK,16,8
610009,Galileo Math & Science Scholastic Academy Elementary School,820 S Carpenter St ,Chicago,60607,Fulton Elementary Network,Not on Probation,Level 1,No,Strong,65,-87.65340205,41.87124634,28,NEAR WEST SIDE,25,12
610072,Garrett A Morgan Elementary School,8407 S Kerfoot Ave ,Chicago,60620,Englewood-Gresham Elementary Network,Probation,Level 3,No,Weak,28,-87.64007166,41.74124549,71,AUBURN GRESHAM,21,6
610293,Genevieve Melody Elementary School,412 S Keeler Ave ,Chicago,60624,Garfield-Humboldt Elementary Network,Probation,Level 3,No,Strong,61,-87.73051772,41.87474954,26,WEST GARFIELD PARK,24,11
609779,George Armstrong International Studies Elementary School,2110 W Greenleaf Ave ,Chicago,60645,Ravenswood-Ridge Elementary Network,Not on Probation,Level 1,No,Average,59,-87.68446868,42.01017628,2,WEST RIDGE,50,24
610062,George B McClellan Elementary School,3527 S Wallace St ,Chicago,60609,Pershing Elementary Network,Probation,Level 2,No,Average,49,-87.64106579,41.82998962,60,BRIDGEPORT,11,9
610196,George B Swift Elementary Specialty School,5900 N Winthrop Ave ,Chicago,60660,Ravenswood-Ridge Elementary Network,Not on Probation,Level 2,No,Strong,61,-87.65833342,41.98915734,77,EDGEWATER,48,20
609849,George F Cassell Elementary School,11314 S Spaulding Ave ,Chicago,60655,Rock Island Elementary Network,Not on Probation,Level 2,No,Strong,76,-87.70325179,41.68733881,74,MOUNT GREENWOOD,19,22
609761,George H Corliss High School,821 E 103rd St ,Chicago,60628,Far South Side High School Network,Probation,Level 3,No,Weak,33,-87.60307842,41.70739096,50,PULLMAN,9,5
610305,George Leland Elementary School,5221 W Congress Pkwy ,Chicago,60644,Austin-North Lawndale Elementary Network,Probation,Level 3,No,NDA,,-87.75571809,41.87382439,25,AUSTIN,29,15
610048,George Manierre Elementary School,1420 N Hudson Ave ,Chicago,60610,Fullerton Elementary Network,Probation,Level 3,No,Average,43,-87.63986347,41.90825367,8,NEAR NORTH SIDE,27,18
610139,George M Pullman Elementary School,11311 S Forrestville Ave ,Chicago,60628,Lake Calumet Elementary Network,Not on Probation,Level 2,No,Average,59,-87.60939383,41.68879566,50,PULLMAN,9,5
609795,George Rogers Clark Elementary School,1045 S Monitor Ave ,Chicago,60644,Austin-North Lawndale Elementary Network,Not on Probation,Level 1,No,Weak,39,-87.77038158,41.8678323,25,AUSTIN,29,15
609760,George Washington Carver Military Academy High School,13100 S Doty Ave ,Chicago,60627,Far South Side High School Network,Not on Probation,Level 2,No,Average,53,-87.5906566,41.65627709,54,RIVERDALE,9,5
609845,George Washington Carver Primary School,901 E 133rd Pl ,Chicago,60827,Lake Calumet Elementary Network,Probation,Level 3,No,Weak,25,-87.59952683,41.65367428,54,RIVERDALE,9,5
610219,George Washington Elementary School,3611 E 114th St ,Chicago,60617,Lake Calumet Elementary Network,Not on Probation,Level 1,No,Average,58,-87.53600985,41.68810403,52,EAST SIDE,10,4
609739,George Washington High School,3535 E 114th St ,Chicago,60617,Far South Side High School Network,Probation,Level 2,No,Average,46,-87.5375501,41.6881094,52,EAST SIDE,10,4
609900,George W Curtis Elementary School,32 E 115th St ,Chicago,60628,AUSL Schools,Probation,Level 3,No,Weak,23,-87.62166148,41.68544575,49,ROSELAND,9,5
609693,George Westinghouse High School,3223 W Franklin Blvd ,Chicago,60624,West Side High School Network,Not on Probation,Not Enough Data,No,Strong,74,-87.70734353,41.88994963,23,HUMBOLDT PARK,28,11
610202,George W Tilton Elementary School,223 N Keeler Ave ,Chicago,60624,Garfield-Humboldt Elementary Network,Probation,Level 3,No,Very Weak,6,-87.73052949,41.88409703,26,WEST GARFIELD PARK,28,11
609920,Gerald Delgado Kanoon Elementary Magnet School,2233 S Kedzie Ave ,Chicago,60623,Pilsen-Little Village Elementary Network,Probation,Level 3,No,Average,44,-87.70507547,41.85077575,30,SOUTH LAWNDALE,24,10
610187,Graeme Stewart Elementary School,4525 N Kenmore Ave ,Chicago,60640,Ravenswood-Ridge Elementary Network,Probation,Level 2,No,Average,49,-87.65605252,41.96434608,3,UPTOWN,46,19
610285,Granville T Woods Math & Science Academy Elementary School,6206 S Racine Ave ,Chicago,60636,Englewood-Gresham Elementary Network,Not on Probation,Level 2,No,Weak,35,-87.65468845,41.7811649,67,WEST ENGLEWOOD,16,7
610383,Greater Lawndale High School For Social Justice,3120 S Kostner Ave ,Chicago,60623,West Side High School Network,Probation,Level 3,No,Average,43,-87.73419465,41.83601953,30,SOUTH LAWNDALE,22,10
609857,Grover Cleveland Elementary School,3121 W Byron St ,Chicago,60618,O'Hare Elementary Network,Not on Probation,Level 1,No,Strong,64,-87.70642927,41.9520147,16,IRVING PARK,33,17
610241,Guglielmo Marconi Elementary Community Academy,230 N Kolmar Ave ,Chicago,60624,Garfield-Humboldt Elementary Network,Probation,Level 3,No,Weak,26,-87.73936153,41.88431659,26,WEST GARFIELD PARK,28,11
609741,Gurdon S Hubbard High School,6200 S Hamlin Ave ,Chicago,60629,Southwest Side High School Network,Not on Probation,Level 2,No,Average,42,-87.71804991,41.78050763,65,WEST LAWN,13,8
609726,Gwendolyn Brooks College Preparatory Academy High School,250 E 111th St ,Chicago,60628,Far South Side High School Network,Not on Probation,Level 1,No,Strong,64,-87.61638144,41.69278956,49,ROSELAND,9,5
610182,Hannah G Solomon Elementary School,6206 N Hamlin Ave ,Chicago,60659,O'Hare Elementary Network,Not on Probation,Level 1,No,Strong,78,-87.72407991,41.99397007,13,NORTH PARK,39,17
610068,Hanson Park Elementary School,5411 W Fullerton Ave ,Chicago,60639,Fullerton Elementary Network,Not on Probation,Level 2,No,Weak,35,-87.76152094,41.92392771,19,BELMONT CRAGIN,37,25
610124,Harold Washington Elementary School,9130 S University Ave ,Chicago,60619,Skyway Elementary Network,Not on Probation,Level 2,No,Weak,28,-87.59629327,41.72853492,47,BURNSIDE,8,4
610192,Harriet Beecher Stowe Elementary School,3444 W Wabansia Ave ,Chicago,60647,Garfield-Humboldt Elementary Network,Probation,Level 3,No,Weak,28,-87.7132855,41.91196584,23,HUMBOLDT PARK,26,14
610158,Harriet E Sayre Elementary Language Academy,1850 N Newland Ave ,Chicago,60707,Austin-North Lawndale Elementary Network,Not on Probation,Level 2,No,Strong,68,-87.79875667,41.9141236,25,AUSTIN,36,25
609974,Hawthorne Elementary Scholastic Academy,3319 N Clifton Ave ,Chicago,60657,Ravenswood-Ridge Elementary Network,Not on Probation,Level 1,Yes,Very Strong,92,-87.65767253,41.94228994,6,LAKE VIEW,44,19
609985,Helen M Hefferan Elementary School,4409 W Wilcox St ,Chicago,60624,Garfield-Humboldt Elementary Network,Not on Probation,Level 2,No,Weak,29,-87.73583687,41.87863685,26,WEST GARFIELD PARK,28,11
610122,Helen Peirce International Studies Elementary School,1423 W Bryn Mawr Ave ,Chicago,60660,Ravenswood-Ridge Elementary Network,Not on Probation,Level 2,No,Average,58,-87.66586537,41.98342819,77,EDGEWATER,48,20
609972,Helge A Haugan Elementary School,4540 N Hamlin Ave ,Chicago,60625,O'Hare Elementary Network,Not on Probation,Level 2,No,Average,43,-87.72316496,41.96403525,14,ALBANY PARK,39,17
609856,Henry Clay Elementary School,13231 S Burley Ave ,Chicago,60633,Lake Calumet Elementary Network,Not on Probation,Level 2,No,Weak,38,-87.544577,41.65455937,55,HEGEWISCH,10,4
610040,Henry D Lloyd Elementary School,2103 N Lamon Ave ,Chicago,60639,Fullerton Elementary Network,Probation,Level 3,No,NDA,,-87.74847861,41.91883022,19,BELMONT CRAGIN,31,25
610092,Henry H Nash Elementary School,4837 W Erie St ,Chicago,60644,Austin-North Lawndale Elementary Network,Probation,Level 3,No,Average,41,-87.74720292,41.89214724,25,AUSTIN,28,15
610279,Henry O Tanner Elementary School,7350 S Evans Ave ,Chicago,60619,Skyway Elementary Network,Probation,Level 3,No,Weak,33,-87.60682834,41.76069854,69,GREATER GRAND CROSSING,6,3
609861,Henry R Clissold Elementary School,2350 W 110th Pl ,Chicago,60643,Rock Island Elementary Network,Not on Probation,Level 2,No,Average,45,-87.6808619,41.69305404,75,MORGAN PARK,19,22
610297,High School of Leadership at South Shore,7627 S Constance Ave ,Chicago,60649,South Side High School Network,Probation,Level 3,No,NDA,,-87.57960727,41.75619362,43,SOUTH SHORE,8,4
609798,Hiram H Belding Elementary School,4257 N Tripp Ave ,Chicago,60641,O'Hare Elementary Network,Not on Probation,Level 2,No,Strong,64,-87.73398223,41.95890499,16,IRVING PARK,38,17
609768,Hope College Preparatory High School,5515 S Lowe Ave ,Chicago,60621,Southwest Side High School Network,Probation,Level 3,No,Weak,31,-87.64134488,41.79355292,68,ENGLEWOOD,3,7
609850,Horace Greeley Elementary School,832 W Sheridan Rd ,Chicago,60613,Ravenswood-Ridge Elementary Network,Not on Probation,Level 1,No,Strong,65,-87.65097549,41.95283701,6,LAKE VIEW,46,19
610052,Horace Mann Elementary School,8050 S Chappel Ave ,Chicago,60617,Skyway Elementary Network,Probation,Level 3,No,Weak,28,-87.57485274,41.74830012,46,SOUTH CHICAGO,8,4
610058,Horatio May Elementary Community Academy,512 S Lavergne Ave ,Chicago,60644,Austin-North Lawndale Elementary Network,Probation,Level 3,No,Average,42,-87.74931216,41.87358321,25,AUSTIN,29,15
609713,Hyde Park Academy High School,6220 S Stony Island Ave ,Chicago,60637,South Side High School Network,Probation,Level 3,No,Weak,29,-87.58665115,41.78223539,42,WOODLAWN,5,3
610390,Hyman G Rickover Naval Academy High School,5900 N Glenwood Ave ,Chicago,60660,North-Northwest Side High School Network,Not on Probation,Level 2,No,Strong,64,-87.66526222,41.98905063,77,EDGEWATER,48,20
610110,Ida B Wells Preparatory Elementary Academy,244 E Pershing Rd ,Chicago,60653,Burnham Park Elementary Network,Probation,Level 3,No,Average,49,-87.61978794,41.82390751,35,DOUGLAS,3,2
610273,Ignance Paderewski Elementary Learning Academy,2221 S Lawndale Ave ,Chicago,60623,Pilsen-Little Village Elementary Network,Probation,Level 3,No,Weak,31,-87.71726618,41.85094816,30,SOUTH LAWNDALE,22,10
610384,Infinity Math Science and Technology High School,3120 S Kostner Ave ,Chicago,60623,West Side High School Network,Not on Probation,Level 2,No,Average,58,-87.73419465,41.83601953,30,SOUTH LAWNDALE,22,10
610078,Inter-American Elementary Magnet School,851 W Waveland Ave ,Chicago,60613,Ravenswood-Ridge Elementary Network,Not on Probation,Level 1,No,Strong,67,-87.65153745,41.94897646,6,LAKE VIEW,44,19
609848,Ira F Aldridge Elementary School,630 E 131st St ,Chicago,60827,Lake Calumet Elementary Network,Probation,Level 3,No,Weak,39,-87.60649623,41.65743243,54,RIVERDALE,9,5
610532,Irene C. Hernandez Middle School for the Advancement of Science,3510 W 55th St ,Chicago,60632,Midway Elementary Network,Not on Probation,Not Enough Data,No,Weak,34,-87.71139803,41.79350627,63,GAGE PARK,14,8
610125,Irma C Ruiz Elementary School,2410 S Leavitt St ,Chicago,60608,Pilsen-Little Village Elementary Network,Not on Probation,Level 2,Yes,Average,57,-87.68078114,41.84809742,31,LOWER WEST SIDE,25,10
610276,Irvin C Mollison Elementary School,4415 S Dr Martin L King Jr Dr ,Chicago,60653,Burnham Park Elementary Network,Probation,Level 3,No,Average,44,-87.61658079,41.81434006,38,GRAND BOULEVARD,3,2
610103,Isabelle C O'Keeffe Elementary School,6940 S Merrill Ave ,Chicago,60649,Skyway Elementary Network,Probation,Level 3,No,Very Weak,17,-87.57284299,41.76861557,43,SOUTH SHORE,5,3
610256,Jackie Robinson Elementary School,4225 S Lake Park Ave ,Chicago,60653,Burnham Park Elementary Network,Probation,Level 3,No,NDA,,-87.59903174,41.81735839,36,OAKLAND,4,2
609797,Jacob Beidler Elementary School,3151 W Walnut St ,Chicago,60612,Garfield-Humboldt Elementary Network,Not on Probation,Level 2,No,Strong,63,-87.70581859,41.88529401,27,EAST GARFIELD PARK,27,13
609766,Jacqueline B Vaughn Occupational High School,4355 N Linder Ave ,Chicago,60641,North-Northwest Side High School Network,Not Applicable,Not Enough Data,No,Average,57,-87.76462602,41.96035141,15,PORTAGE PARK,38,16
609912,James B Farnsworth Elementary School,5414 N Linder Ave ,Chicago,60630,O'Hare Elementary Network,Not on Probation,Level 2,No,Average,55,-87.76610809,41.9798092,11,JEFFERSON PARK,45,16
610070,James B McPherson Elementary School,4728 N Wolcott Ave ,Chicago,60640,Ravenswood-Ridge Elementary Network,Not on Probation,Level 2,No,Strong,71,-87.67632505,41.96784758,4,LINCOLN SQUARE,47,19
610066,James E McDade Elementary Classical School,8801 S Indiana Ave ,Chicago,60619,Skyway Elementary Network,Not on Probation,Level 1,No,Very Strong,99,-87.61917677,41.73451387,44,CHATHAM,6,6
609803,James G Blaine Elementary School,1420 W Grace St ,Chicago,60613,Ravenswood-Ridge Elementary Network,Not on Probation,Level 1,No,Very Strong,99,-87.66495825,41.95080812,6,LAKE VIEW,44,19
609983,James Hedges Elementary School,4747 S Winchester Ave ,Chicago,60609,Pershing Elementary Network,Not on Probation,Level 2,No,Weak,22,-87.67329121,41.80713406,61,NEW CITY,20,9
610047,James Madison Elementary School,7433 S Dorchester Ave ,Chicago,60619,Skyway Elementary Network,Probation,Level 2,No,Weak,39,-87.59067582,41.75955224,43,SOUTH SHORE,5,3
610074,James Monroe Elementary School,3651 W Schubert Ave ,Chicago,60647,Fullerton Elementary Network,Probation,Level 2,No,Average,45,-87.71921246,41.92996135,22,LOGAN SQUARE,35,25
610200,James N Thorp Elementary School,8914 S Buffalo Ave ,Chicago,60617,Skyway Elementary Network,Probation,Level 3,No,Weak,32,-87.54451462,41.73331035,46,SOUTH CHICAGO,10,4
610107,James Otis Elementary School,525 N Armour St ,Chicago,60622,Fulton Elementary Network,Probation,Level 1,No,Very Strong,83,-87.66538928,41.89179703,24,WEST TOWN,27,13
609891,James R Doolittle Jr Elementary School,535 E 35th St ,Chicago,60616,Burnham Park Elementary Network,Probation,Level 3,No,Weak,30,-87.61291629,41.8310921,35,DOUGLAS,4,2
610044,James Russell Lowell Elementary School,3320 W Hirsch St ,Chicago,60651,Garfield-Humboldt Elementary Network,Probation,Level 2,No,Weak,39,-87.71023279,41.90654684,23,HUMBOLDT PARK,26,14
610174,James Shields Elementary School,4250 S Rockwell St ,Chicago,60632,Pershing Elementary Network,Not on Probation,Level 2,No,Weak,38,-87.68968453,41.81593528,58,BRIGHTON PARK,12,9
610213,James Wadsworth Elementary School,6420 S University Ave ,Chicago,60637,Burnham Park Elementary Network,Probation,Level 3,No,NDA,,-87.59815597,41.77812652,42,WOODLAWN,20,3
610217,James Ward Elementary School,2701 S Shields Ave ,Chicago,60616,Pershing Elementary Network,Not on Probation,Level 1,No,Average,49,-87.63531815,41.84395162,34,ARMOUR SQUARE,11,9
610274,James Weldon Johnson Elementary School,1420 S Albany Ave ,Chicago,60623,AUSL Schools,Probation,Level 2,No,Strong,67,-87.7031756,41.86183983,29,NORTH LAWNDALE,24,10
609772,Jane Addams Elementary School,10810 S Avenue H ,Chicago,60617,Lake Calumet Elementary Network,Not on Probation,Level 2,No,Average,56,-87.53301251,41.69871497,52,EAST SIDE,10,4
610093,Jane A Neil Elementary School,8555 S Michigan Ave ,Chicago,60619,Skyway Elementary Network,Probation,Level 3,No,Average,42,-87.62089767,41.7384386,44,CHATHAM,6,6
609796,Jean Baptiste Beaubien Elementary School,5025 N Laramie Ave ,Chicago,60630,O'Hare Elementary Network,Not on Probation,Level 1,No,Strong,63,-87.75752776,41.97237914,11,JEFFERSON PARK,45,16
610031,Jean D Lafayette Elementary School,2714 W Augusta Blvd ,Chicago,60622,Fulton Elementary Network,Probation,Level 3,No,Average,44,-87.69494543,41.89940402,24,WEST TOWN,1,13
610271,Jensen Elementary Scholastic Academy,3030 W Harrison St ,Chicago,60612,Garfield-Humboldt Elementary Network,Probation,Level 2,No,Weak,35,-87.70224149,41.87384239,27,EAST GARFIELD PARK,28,11
609932,Jesse Owens Elementary Community Academy,12450 S State St ,Chicago,60628,Lake Calumet Elementary Network,Not on Probation,Level 2,No,NDA,,-87.62242272,41.66737294,53,WEST PULLMAN,9,5
610173,Jesse Sherwood Elementary School,245 W 57th St ,Chicago,60621,Englewood-Gresham Elementary Network,Probation,Level 2,No,Weak,38,-87.6322812,41.7907728,68,ENGLEWOOD,20,7
609942,Johann W von Goethe Elementary School,2236 N Rockwell St ,Chicago,60647,Fullerton Elementary Network,Not on Probation,Level 2,No,Strong,75,-87.69293637,41.9228282,22,LOGAN SQUARE,1,14
610216,John A Walsh Elementary School,2015 S Peoria St ,Chicago,60608,Pilsen-Little Village Elementary Network,Not on Probation,Level 2,Yes,Strong,60,-87.64804964,41.85484214,31,LOWER WEST SIDE,25,12
609789,John Barry Elementary School,2828 N Kilbourn Ave ,Chicago,60641,Fullerton Elementary Network,Not on Probation,Level 2,No,Weak,35,-87.73942514,41.93251118,20,HERMOSA,31,25
609894,John B Drake Elementary School,2722 S King Dr ,Chicago,60616,Burnham Park Elementary Network,Probation,Level 3,No,Average,59,-87.61776768,41.84379445,35,DOUGLAS,4,1
610089,John B Murphy Elementary School,3539 W Grace St ,Chicago,60618,O'Hare Elementary Network,Not on Probation,Level 1,No,Very Strong,80,-87.71682949,41.95005034,16,IRVING PARK,35,17
610243,John Calhoun North Elementary School,2833 W Adams St ,Chicago,60612,Garfield-Humboldt Elementary Network,Not on Probation,Level 1,No,Average,52,-87.69755292,41.87822115,27,EAST GARFIELD PARK,2,11
609829,John C Burroughs Elementary School,3542 S Washtenaw Ave ,Chicago,60632,Pershing Elementary Network,Not on Probation,Level 2,Yes,Average,50,-87.69249318,41.8288631,58,BRIGHTON PARK,12,9
